Compare,PMID,Parameter,Sentece,Title,Type,URL,Units,Value,id,Drugbank_id,Name
,9193875,apparent steady-state volume of distribution,"The following pharmacokinetic parameter values were obtained (mean +/- SD): terminal disposition half-life, 17.7 +/- 0.08 min; apparent steady-state volume of distribution, 0.89 +/- 0.14 liters/kg; systemic body clearance, 68.9 +/- 10.0 ml/kg *min; and mean residence time, 13.1 +/- 2.2 min.","Oral and topical absorption, disposition kinetics, and the metabolic fate of trans-methyl styryl ketone in the male Fischer 344 rat. ",Vss-Q65,[Article Link](https://pubmed.ncbi.nlm.nih.gov/9193875/),[l] / [kg],0.89,195605,DB00145,Glycine
,9193875,systemic body clearance,"The following pharmacokinetic parameter values were obtained (mean +/- SD): terminal disposition half-life, 17.7 +/- 0.08 min; apparent steady-state volume of distribution, 0.89 +/- 0.14 liters/kg; systemic body clearance, 68.9 +/- 10.0 ml/kg *min; and mean residence time, 13.1 +/- 2.2 min.","Oral and topical absorption, disposition kinetics, and the metabolic fate of trans-methyl styryl ketone in the male Fischer 344 rat. ",CL-Q22,[Article Link](https://pubmed.ncbi.nlm.nih.gov/9193875/),[ml] / [kg·min],68.9,195606,DB00145,Glycine
,9193875,mean residence time,"The following pharmacokinetic parameter values were obtained (mean +/- SD): terminal disposition half-life, 17.7 +/- 0.08 min; apparent steady-state volume of distribution, 0.89 +/- 0.14 liters/kg; systemic body clearance, 68.9 +/- 10.0 ml/kg *min; and mean residence time, 13.1 +/- 2.2 min.","Oral and topical absorption, disposition kinetics, and the metabolic fate of trans-methyl styryl ketone in the male Fischer 344 rat. ",MRT-Q53,[Article Link](https://pubmed.ncbi.nlm.nih.gov/9193875/),min,13.1,195607,DB00145,Glycine
,16611415,blood half-life,"Three factors were identified: 1) tumor cell integrin expression (the alpha(V)beta3 integrin was expressed in BT-20 cells, but not in 9L cells); 2) nanoparticle pharmacokinetics (the cyclic RGD peptide cross-linked iron oxide had a blood half-life of 180 minutes and was able to escape from the vasculature over its long circulation time); and 3) tumor vascularization (the tumor had a dense capillary bed, with distances of <100 microm between capillaries).",Nanoparticle imaging of integrins on tumor cells. ,t1/2-Q57,[Article Link](https://pubmed.ncbi.nlm.nih.gov/16611415/),min,180,196054,DB00145,Glycine
,19607892,elimination half-lives (T(1/2beta)),"For glyphosate, the elimination half-lives (T(1/2beta)) from plasma were 9.99 h after i.v. and 14.38 h after oral administration.",Toxicokinetics of glyphosate and its metabolite aminomethyl phosphonic acid in rats. ,"t1/2,β-Q60",[Article Link](https://pubmed.ncbi.nlm.nih.gov/19607892/),h,9.99,198979,DB00145,Glycine
,19607892,elimination half-lives (T(1/2beta)),"For glyphosate, the elimination half-lives (T(1/2beta)) from plasma were 9.99 h after i.v. and 14.38 h after oral administration.",Toxicokinetics of glyphosate and its metabolite aminomethyl phosphonic acid in rats. ,"t1/2,β-Q60",[Article Link](https://pubmed.ncbi.nlm.nih.gov/19607892/),h,14.38,198980,DB00145,Glycine
,19607892,total plasma clearance,The total plasma clearance was not influenced by dose concentration or route and reached a value of 0.995 l h(-1)kg(-1).,Toxicokinetics of glyphosate and its metabolite aminomethyl phosphonic acid in rats. ,CL-Q22,[Article Link](https://pubmed.ncbi.nlm.nih.gov/19607892/),[l] / [h],0.995,198981,DB00145,Glycine
,19607892,apparent volume of distribution in the second compartment (V(2)),"After i.v. administration, the apparent volume of distribution in the second compartment (V(2)) and volume of distribution at steady state (V(ss)) were 2.39 and 2.99 l kg(-1), respectively, suggesting a considerable diffusion of the herbicide into tissues.",Toxicokinetics of glyphosate and its metabolite aminomethyl phosphonic acid in rats. ,V2-Q64,[Article Link](https://pubmed.ncbi.nlm.nih.gov/19607892/),[l] / [kg],2.39,198982,DB00145,Glycine
,19607892,volume of distribution at steady state (V(ss)),"After i.v. administration, the apparent volume of distribution in the second compartment (V(2)) and volume of distribution at steady state (V(ss)) were 2.39 and 2.99 l kg(-1), respectively, suggesting a considerable diffusion of the herbicide into tissues.",Toxicokinetics of glyphosate and its metabolite aminomethyl phosphonic acid in rats. ,Vss-Q65,[Article Link](https://pubmed.ncbi.nlm.nih.gov/19607892/),[l] / [kg],2.99,198983,DB00145,Glycine
,19607892,T(max),"After oral administration, glyphosate was partially and slowly absorbed with a T(max) of 5.16 h.",Toxicokinetics of glyphosate and its metabolite aminomethyl phosphonic acid in rats. ,tmax-Q56,[Article Link](https://pubmed.ncbi.nlm.nih.gov/19607892/),h,5.16,198984,DB00145,Glycine
,19607892,oral bioavailability,The oral bioavailability of glyphosate was found to be 23.21%.,Toxicokinetics of glyphosate and its metabolite aminomethyl phosphonic acid in rats. ,F-Q40,[Article Link](https://pubmed.ncbi.nlm.nih.gov/19607892/),%,23.21,198985,DB00145,Glycine
,19607892,maximum plasma concentrations,"The maximum plasma concentrations of glyphosate and AMPA were 4.62 and 0.416 microg ml(-1), respectively.",Toxicokinetics of glyphosate and its metabolite aminomethyl phosphonic acid in rats. ,Cmax-Q32,[Article Link](https://pubmed.ncbi.nlm.nih.gov/19607892/),[μg] / [ml],4.62,198986,DB00145,Glycine
,19607892,maximum plasma concentrations,"The maximum plasma concentrations of glyphosate and AMPA were 4.62 and 0.416 microg ml(-1), respectively.",Toxicokinetics of glyphosate and its metabolite aminomethyl phosphonic acid in rats. ,Cmax-Q32,[Article Link](https://pubmed.ncbi.nlm.nih.gov/19607892/),[μg] / [ml],0.416,198987,DB00145,Glycine
,19607892,elimination half-life (T(1/2beta)),"For AMPA, the elimination half-life (T(1/2beta)) was 15.08 h after oral administration of glyphosate parent compound.",Toxicokinetics of glyphosate and its metabolite aminomethyl phosphonic acid in rats. ,"t1/2,β-Q60",[Article Link](https://pubmed.ncbi.nlm.nih.gov/19607892/),h,15.08,198988,DB00145,Glycine
,7274310,terminal half-life,The plasma concentration/time curve displayed a biphasic profile and the terminal half-life of Ticlopidine was tentatively estimated to be 6-10 h in the rat.,"Metabolism of ticlopidine in rats: identification and quantitative determination of some its metabolites in plasma, urine and bile. ","t1/2,β-Q60",[Article Link](https://pubmed.ncbi.nlm.nih.gov/7274310/),h,6-10,199048,DB00145,Glycine
,29846887,time to maximum plasma concentration,Median time to maximum plasma concentration was 3.0-4.5 h with steady state being reached between days 6 and 10.,"Multiple Rising Doses of Oral BI 425809, a GlyT1 Inhibitor, in Young and Elderly Healthy Volunteers: A Randomised, Double-Blind, Phase I Study Investigating Safety and Pharmacokinetics. ",tmax-Q56,[Article Link](https://pubmed.ncbi.nlm.nih.gov/29846887/),h,3.0-4.5,201684,DB00145,Glycine
,1874879,limit of detection,"The extraction procedures are simple with a limit of detection 2 and 0.5 micrograms/ml for milacemide in plasma and cerebrospinal fluid, respectively, and 0.5 micrograms/ml for glycinamide in plasma or cerebrospinal fluid.",Simple and rapid micro-analytical procedures for the estimation of milacemide and its metabolite glycinamide in rat plasma and cerebrospinal fluid by high-performance liquid chromatography. ,NIL-Q100,[Article Link](https://pubmed.ncbi.nlm.nih.gov/1874879/),[μg] / [ml],2,202184,DB00145,Glycine
,1874879,limit of detection,"The extraction procedures are simple with a limit of detection 2 and 0.5 micrograms/ml for milacemide in plasma and cerebrospinal fluid, respectively, and 0.5 micrograms/ml for glycinamide in plasma or cerebrospinal fluid.",Simple and rapid micro-analytical procedures for the estimation of milacemide and its metabolite glycinamide in rat plasma and cerebrospinal fluid by high-performance liquid chromatography. ,NIL-Q100,[Article Link](https://pubmed.ncbi.nlm.nih.gov/1874879/),[μg] / [ml],0.5,202185,DB00145,Glycine
,1685770,half-life of clearance,"After intravenous injection, the half-life of clearance of authentic FTCP from blood was 4.2 min in mice, 12 min in rats and 45 min in a rhesus monkey.","In vivo study of NMDA-sensitive glutamate receptor by fluorothienylcyclohexylpiperidine [correction of fluorothienylcycloexylpiperidine], a possible ligand for positron emission tomography. ",t1/2-Q57,[Article Link](https://pubmed.ncbi.nlm.nih.gov/1685770/),min,4.2,208370,DB00145,Glycine
,1685770,half-life of clearance,"After intravenous injection, the half-life of clearance of authentic FTCP from blood was 4.2 min in mice, 12 min in rats and 45 min in a rhesus monkey.","In vivo study of NMDA-sensitive glutamate receptor by fluorothienylcyclohexylpiperidine [correction of fluorothienylcycloexylpiperidine], a possible ligand for positron emission tomography. ",t1/2-Q57,[Article Link](https://pubmed.ncbi.nlm.nih.gov/1685770/),min,12,208371,DB00145,Glycine
,1685770,half-life of clearance,"After intravenous injection, the half-life of clearance of authentic FTCP from blood was 4.2 min in mice, 12 min in rats and 45 min in a rhesus monkey.","In vivo study of NMDA-sensitive glutamate receptor by fluorothienylcyclohexylpiperidine [correction of fluorothienylcycloexylpiperidine], a possible ligand for positron emission tomography. ",t1/2-Q57,[Article Link](https://pubmed.ncbi.nlm.nih.gov/1685770/),min,45,208372,DB00145,Glycine
,8742934,absolute bioavailability,Coadministration of 10 mM GDC increased the absolute bioavailability of FD4 from 1.8 +/- 0.5% to 12.7 +/- 2.0%.,In-vivo buccal delivery of fluorescein isothiocyanate-dextran 4400 with glycodeoxycholate as an absorption enhancer in pigs. ,F-Q40,[Article Link](https://pubmed.ncbi.nlm.nih.gov/8742934/),%,1.8,208754,DB00145,Glycine
,8742934,absolute bioavailability,Coadministration of 10 mM GDC increased the absolute bioavailability of FD4 from 1.8 +/- 0.5% to 12.7 +/- 2.0%.,In-vivo buccal delivery of fluorescein isothiocyanate-dextran 4400 with glycodeoxycholate as an absorption enhancer in pigs. ,F-Q40,[Article Link](https://pubmed.ncbi.nlm.nih.gov/8742934/),%,12.7,208755,DB00145,Glycine
,31152925,particle size,"The mean particle size and zeta potential of the RGD-DOX-SLNs was 96.3 nm and 35.6 mV, respectively.","Improving breast cancer therapy using doxorubicin loaded solid lipid nanoparticles: Synthesis of a novel arginine-glycine-aspartic tripeptide conjugated, pH sensitive lipid and evaluation of the nanomedicine in vitro and in vivo. ",NIL-Q100,[Article Link](https://pubmed.ncbi.nlm.nih.gov/31152925/),nm,96.3,208915,DB00145,Glycine
,31152925,zeta potential,"The mean particle size and zeta potential of the RGD-DOX-SLNs was 96.3 nm and 35.6 mV, respectively.","Improving breast cancer therapy using doxorubicin loaded solid lipid nanoparticles: Synthesis of a novel arginine-glycine-aspartic tripeptide conjugated, pH sensitive lipid and evaluation of the nanomedicine in vitro and in vivo. ",NIL-Q100,[Article Link](https://pubmed.ncbi.nlm.nih.gov/31152925/),mv,35.6,208916,DB00145,Glycine
,31152925,Terminal half life (T1/2),Terminal half life (T1/2) and peak concentration (Cmax) of RGD-DOX-SLNs was 10.85 h and 39.12 ± 2.71 L/kg/h. in vitro and in vivo antitumor results indicate that RGD-DOX-SLNs might be a promising novel lipid carrier which could improve breast cancer therapy.,"Improving breast cancer therapy using doxorubicin loaded solid lipid nanoparticles: Synthesis of a novel arginine-glycine-aspartic tripeptide conjugated, pH sensitive lipid and evaluation of the nanomedicine in vitro and in vivo. ","t1/2,β-Q60",[Article Link](https://pubmed.ncbi.nlm.nih.gov/31152925/),h,10.85,208917,DB00145,Glycine
,31152925,peak concentration (Cmax),Terminal half life (T1/2) and peak concentration (Cmax) of RGD-DOX-SLNs was 10.85 h and 39.12 ± 2.71 L/kg/h. in vitro and in vivo antitumor results indicate that RGD-DOX-SLNs might be a promising novel lipid carrier which could improve breast cancer therapy.,"Improving breast cancer therapy using doxorubicin loaded solid lipid nanoparticles: Synthesis of a novel arginine-glycine-aspartic tripeptide conjugated, pH sensitive lipid and evaluation of the nanomedicine in vitro and in vivo. ",Cmax-Q32,[Article Link](https://pubmed.ncbi.nlm.nih.gov/31152925/),[l] / [h·kg],39.12,208918,DB00145,Glycine
,9330777,clearance (Cl),"Following i.v. administration (556 mg) to six dogs, VCGD had a clearance (Cl) value of 3.8 +/- 1.1 Lh-1 (mean +/- SD), a volume of distribution (Vss) of 15 +/- 2 L, and a half-life (t1/2) of 1.9 +/- 0.3 h.",Pharmacokinetic analysis and antiepileptic activity of two new isomers of N-valproyl glycinamide. ,CL-Q22,[Article Link](https://pubmed.ncbi.nlm.nih.gov/9330777/),1/[lh],3.8,210911,DB00145,Glycine
,9330777,volume of distribution (Vss),"Following i.v. administration (556 mg) to six dogs, VCGD had a clearance (Cl) value of 3.8 +/- 1.1 Lh-1 (mean +/- SD), a volume of distribution (Vss) of 15 +/- 2 L, and a half-life (t1/2) of 1.9 +/- 0.3 h.",Pharmacokinetic analysis and antiepileptic activity of two new isomers of N-valproyl glycinamide. ,Vss-Q65,[Article Link](https://pubmed.ncbi.nlm.nih.gov/9330777/),l,15,210912,DB00145,Glycine
,9330777,half-life (t1/2),"Following i.v. administration (556 mg) to six dogs, VCGD had a clearance (Cl) value of 3.8 +/- 1.1 Lh-1 (mean +/- SD), a volume of distribution (Vss) of 15 +/- 2 L, and a half-life (t1/2) of 1.9 +/- 0.3 h.",Pharmacokinetic analysis and antiepileptic activity of two new isomers of N-valproyl glycinamide. ,t1/2-Q57,[Article Link](https://pubmed.ncbi.nlm.nih.gov/9330777/),h,1.9,210913,DB00145,Glycine
,9330777,Cl,"DIGD had Cl, Vss, and t1/2 values of 10 +/- 0.8 Lh-1, 19 +/- 3 L, and 1.6 +/- 0.2 h, respectively.",Pharmacokinetic analysis and antiepileptic activity of two new isomers of N-valproyl glycinamide. ,CL-Q22,[Article Link](https://pubmed.ncbi.nlm.nih.gov/9330777/),1/[lh],10,210914,DB00145,Glycine
,9330777,Vss,"DIGD had Cl, Vss, and t1/2 values of 10 +/- 0.8 Lh-1, 19 +/- 3 L, and 1.6 +/- 0.2 h, respectively.",Pharmacokinetic analysis and antiepileptic activity of two new isomers of N-valproyl glycinamide. ,Vss-Q65,[Article Link](https://pubmed.ncbi.nlm.nih.gov/9330777/),l,19,210915,DB00145,Glycine
,9330777,t1/2,"DIGD had Cl, Vss, and t1/2 values of 10 +/- 0.8 Lh-1, 19 +/- 3 L, and 1.6 +/- 0.2 h, respectively.",Pharmacokinetic analysis and antiepileptic activity of two new isomers of N-valproyl glycinamide. ,t1/2-Q57,[Article Link](https://pubmed.ncbi.nlm.nih.gov/9330777/),h,1.6,210916,DB00145,Glycine
,9330777,fractions metabolized (fm),Both glycinamides were biotransformed to their glycine analogues with similar fractions metabolized (fm): 59 +/- 5% (VCGD) and 62 +/- 15% (DIGD).,Pharmacokinetic analysis and antiepileptic activity of two new isomers of N-valproyl glycinamide. ,fm-Q45,[Article Link](https://pubmed.ncbi.nlm.nih.gov/9330777/),%,59,210917,DB00145,Glycine
,9330777,fractions metabolized (fm),Both glycinamides were biotransformed to their glycine analogues with similar fractions metabolized (fm): 59 +/- 5% (VCGD) and 62 +/- 15% (DIGD).,Pharmacokinetic analysis and antiepileptic activity of two new isomers of N-valproyl glycinamide. ,fm-Q45,[Article Link](https://pubmed.ncbi.nlm.nih.gov/9330777/),%,62,210918,DB00145,Glycine
,9330777,t1/2,"Both VCGA and DIGA had higher Cl and lower Vss values than VCGD and DIGD and therefore their mean t1/2 values were 0.43 +/- 0.02 and 0.30 +/- 0.07 h, respectively.",Pharmacokinetic analysis and antiepileptic activity of two new isomers of N-valproyl glycinamide. ,t1/2-Q57,[Article Link](https://pubmed.ncbi.nlm.nih.gov/9330777/),h,0.43,210919,DB00145,Glycine
,9330777,t1/2,"Both VCGA and DIGA had higher Cl and lower Vss values than VCGD and DIGD and therefore their mean t1/2 values were 0.43 +/- 0.02 and 0.30 +/- 0.07 h, respectively.",Pharmacokinetic analysis and antiepileptic activity of two new isomers of N-valproyl glycinamide. ,t1/2-Q57,[Article Link](https://pubmed.ncbi.nlm.nih.gov/9330777/),h,0.30,210920,DB00145,Glycine
,9330777,fractions excreted unchanged (fe),"VCGA and DIGA were excreted mainly intact in the urine, with fractions excreted unchanged (fe) of 60 +/- 9 and 55 +/- 7%, respectively.",Pharmacokinetic analysis and antiepileptic activity of two new isomers of N-valproyl glycinamide. ,fe-Q44,[Article Link](https://pubmed.ncbi.nlm.nih.gov/9330777/),%,60,210921,DB00145,Glycine
,9330777,fractions excreted unchanged (fe),"VCGA and DIGA were excreted mainly intact in the urine, with fractions excreted unchanged (fe) of 60 +/- 9 and 55 +/- 7%, respectively.",Pharmacokinetic analysis and antiepileptic activity of two new isomers of N-valproyl glycinamide. ,fe-Q44,[Article Link](https://pubmed.ncbi.nlm.nih.gov/9330777/),%,55,210922,DB00145,Glycine
,28854403,runtime,"The analyte and internal standard were separated on a Shimadzu Shim-pack XR-ODS column (4.6×50mm, 2.2μm) using 0.1% formic acid-water-methanol as mobile phase, with a runtime of 5min.",An HPLC-MS/MS method for quantitation of Gly-MCA in mouse plasma: Application to a pharmacokinetic study. ,NIL-Q100,[Article Link](https://pubmed.ncbi.nlm.nih.gov/28854403/),min,5,212967,DB00145,Glycine
,12818629,bioavailability,"Ximelagatran is therefore much better than melagatran at penetrating the gastrointestinal barrier and, as a consequence, has sufficient bioavailability (20%) for oral administration.",The pharmacodynamics and pharmacokinetics of the oral direct thrombin inhibitor ximelagatran and its active metabolite melagatran: a mini-review. ,F-Q40,[Article Link](https://pubmed.ncbi.nlm.nih.gov/12818629/),%,20,213333,DB00145,Glycine
,7834163,terminal plasma t1/2,"Under acidic urine conditions, salicylic acid (SA) had a terminal plasma t1/2 value of 3.29 +/- 0.52 hours while under alkaline urine conditions this t1/2 was significantly reduced to 2.50 +/- 0.41 hours (p = 0.0156).","Effect of urinary pH on the pharmacokinetics of salicylic acid, with its glycine and glucuronide conjugates in human. ","t1/2,β-Q60",[Article Link](https://pubmed.ncbi.nlm.nih.gov/7834163/),h,3.29,213740,DB00145,Glycine
,7834163,t1/2,"Under acidic urine conditions, salicylic acid (SA) had a terminal plasma t1/2 value of 3.29 +/- 0.52 hours while under alkaline urine conditions this t1/2 was significantly reduced to 2.50 +/- 0.41 hours (p = 0.0156).","Effect of urinary pH on the pharmacokinetics of salicylic acid, with its glycine and glucuronide conjugates in human. ",t1/2-Q57,[Article Link](https://pubmed.ncbi.nlm.nih.gov/7834163/),h,2.50,213741,DB00145,Glycine
,7834163,total oral body clearance,The total oral body clearance of salicylic acid under acidic conditions (1.38 +/- 0.43 l/h) is significantly lower than under alkaline urine conditions (2.27 +/- 0.83 l/h; p = 0.0410).,"Effect of urinary pH on the pharmacokinetics of salicylic acid, with its glycine and glucuronide conjugates in human. ",CLpo-Q27,[Article Link](https://pubmed.ncbi.nlm.nih.gov/7834163/),[l] / [h],1.38,213742,DB00145,Glycine
,7834163,total oral body clearance,The total oral body clearance of salicylic acid under acidic conditions (1.38 +/- 0.43 l/h) is significantly lower than under alkaline urine conditions (2.27 +/- 0.83 l/h; p = 0.0410).,"Effect of urinary pH on the pharmacokinetics of salicylic acid, with its glycine and glucuronide conjugates in human. ",CLpo-Q27,[Article Link](https://pubmed.ncbi.nlm.nih.gov/7834163/),[l] / [h],2.27,213743,DB00145,Glycine
,7834163,protein binding,The protein binding of SA was 93.8 +/- 1.0% and that of SU was 89.7 +/- 2.2% in vivo and in vitro.,"Effect of urinary pH on the pharmacokinetics of salicylic acid, with its glycine and glucuronide conjugates in human. ",NIL-Q100,[Article Link](https://pubmed.ncbi.nlm.nih.gov/7834163/),%,93.8,213744,DB00145,Glycine
,7834163,protein binding,The protein binding of SA was 93.8 +/- 1.0% and that of SU was 89.7 +/- 2.2% in vivo and in vitro.,"Effect of urinary pH on the pharmacokinetics of salicylic acid, with its glycine and glucuronide conjugates in human. ",NIL-Q100,[Article Link](https://pubmed.ncbi.nlm.nih.gov/7834163/),%,89.7,213745,DB00145,Glycine
,7834163,protein binding,"SUPG had a protein binding of 84.8 +/- 1.8%, while SAPG showed no protein binding at all.","Effect of urinary pH on the pharmacokinetics of salicylic acid, with its glycine and glucuronide conjugates in human. ",NIL-Q100,[Article Link](https://pubmed.ncbi.nlm.nih.gov/7834163/),%,84.8,213746,DB00145,Glycine
,12029548,t(1/2),A rapid method for radiolabelling short peptides with 18F ( t(1/2)=109.7 min) for use in positron emission tomography (PET) was developed.,Rapid solid phase synthesis and biodistribution of 18F-labelled linear peptides. ,t1/2-Q57,[Article Link](https://pubmed.ncbi.nlm.nih.gov/12029548/),min,109.7,218640,DB00145,Glycine
,12029548,overall synthesis time,"The linear peptides were rapidly labelled with 4-[18F]fluorobenzoic acid with an overall radiochemical yield of 80%-90% (decay corrected), a radiochemical purity of >95% without HPLC purification and an overall synthesis time of 20 min.",Rapid solid phase synthesis and biodistribution of 18F-labelled linear peptides. ,NIL-Q100,[Article Link](https://pubmed.ncbi.nlm.nih.gov/12029548/),min,20,218641,DB00145,Glycine
,2148814,half-life,"The half-life of 125I-ANF (99-126) in mouse blood in vivo, evaluated after HPLC analysis, was approximately 0.5 min.",Degradation of atrial natriuretic factor in mouse blood in vitro and in vivo: role of enkephalinase (EC 3.4.24.11). ,t1/2-Q57,[Article Link](https://pubmed.ncbi.nlm.nih.gov/2148814/),min,0.5,218950,DB00145,Glycine
,31325170,total run time,"EDB, IDB, VDB and the IS eluted at 7.36, 8.60, 9.50 and 5.12 min, respectively, with a total run time of 10 min.","Validated HPLC method for simultaneous quantification of mutant IDH1/2 inhibitors (enasidenib, ivosidenib and vorasidenib) in mouse plasma: Application to a pharmacokinetic study. ",NIL-Q100,[Article Link](https://pubmed.ncbi.nlm.nih.gov/31325170/),min,10,220858,DB00145,Glycine
,9113346,"dissociation constant, Kd,1","The highest binding affinity for dansylsarcosine was observed with HSA (dissociation constant, Kd,1 = 0.5 microM), while it was lowest in the mouse (Kd,1 = 18 microM).",Determination of protein binding of troglitazone stereoisomers by fluorometric titration. ,Ki-Q11,[Article Link](https://pubmed.ncbi.nlm.nih.gov/9113346/),μM,0.5,221049,DB00145,Glycine
,9113346,"Kd,1","The highest binding affinity for dansylsarcosine was observed with HSA (dissociation constant, Kd,1 = 0.5 microM), while it was lowest in the mouse (Kd,1 = 18 microM).",Determination of protein binding of troglitazone stereoisomers by fluorometric titration. ,NIL-Q100,[Article Link](https://pubmed.ncbi.nlm.nih.gov/9113346/),μM,18,221050,DB00145,Glycine
,9113346,Ki,"The Ki values for KK and ddY mouse plasma and mouse and rat albumin were in the range 2-15 microM, and there were no large variations among stereoisomers, the maximum differences being twofold.",Determination of protein binding of troglitazone stereoisomers by fluorometric titration. ,Ki-Q11,[Article Link](https://pubmed.ncbi.nlm.nih.gov/9113346/),μM,2-15,221051,DB00145,Glycine
,9662600,extraction fraction,"After peripheral injection in dogs, there was an early arteriovenous concentration gradient across the liver indicating an hepatocyte extraction fraction in the three animals of 0.9, 0.8 and 0.6.",Bidirectional transport of iminodiacetic organic anion analogues between plasma and hepatocyte. ,NIL-Q100,[Article Link](https://pubmed.ncbi.nlm.nih.gov/9662600/),,0.9,222012,DB00145,Glycine
,9662600,extraction fraction,"After peripheral injection in dogs, there was an early arteriovenous concentration gradient across the liver indicating an hepatocyte extraction fraction in the three animals of 0.9, 0.8 and 0.6.",Bidirectional transport of iminodiacetic organic anion analogues between plasma and hepatocyte. ,NIL-Q100,[Article Link](https://pubmed.ncbi.nlm.nih.gov/9662600/),,0.8,222013,DB00145,Glycine
,9662600,extraction fraction,"After peripheral injection in dogs, there was an early arteriovenous concentration gradient across the liver indicating an hepatocyte extraction fraction in the three animals of 0.9, 0.8 and 0.6.",Bidirectional transport of iminodiacetic organic anion analogues between plasma and hepatocyte. ,NIL-Q100,[Article Link](https://pubmed.ncbi.nlm.nih.gov/9662600/),,0.6,222014,DB00145,Glycine
,10206321,absorptive clearances,"The absorptive clearances of the tripeptoid and tetrapeptide were 6.7 and 4.8 x 10(-4) mL min(-1) cm(-1), respectively, and the corresponding octanol/water partition coefficients were 0.39 and 0.30.",Absorption and disposition of a tripeptoid and a tetrapeptide in the rat. ,ka-Q49,[Article Link](https://pubmed.ncbi.nlm.nih.gov/10206321/),[ml] / [cm·min],6.7,224094,DB00145,Glycine
,10206321,absorptive clearances,"The absorptive clearances of the tripeptoid and tetrapeptide were 6.7 and 4.8 x 10(-4) mL min(-1) cm(-1), respectively, and the corresponding octanol/water partition coefficients were 0.39 and 0.30.",Absorption and disposition of a tripeptoid and a tetrapeptide in the rat. ,ka-Q49,[Article Link](https://pubmed.ncbi.nlm.nih.gov/10206321/),[ml] / [cm·min],4.8 x 10(-4),224095,DB00145,Glycine
,10206321,octanol/water partition coefficients,"The absorptive clearances of the tripeptoid and tetrapeptide were 6.7 and 4.8 x 10(-4) mL min(-1) cm(-1), respectively, and the corresponding octanol/water partition coefficients were 0.39 and 0.30.",Absorption and disposition of a tripeptoid and a tetrapeptide in the rat. ,Papp-Q6,[Article Link](https://pubmed.ncbi.nlm.nih.gov/10206321/),,0.39,224096,DB00145,Glycine
