Compare,PMID,Parameter,Sentece,Title,Type,URL,Units,Value,id,Drugbank_id,Name
,536844,pancreas-to-liver ratio,A pancreas-to-liver ratio of 8.6 +/- 2.7 is observed during the first hour after i.v. injection.,Accumulation of radioiodinated L-alpha-methyltyrosine in pancreas of mice: concise communication. ,NIL-Q100,[Article Link](https://pubmed.ncbi.nlm.nih.gov/536844/),,8.6,56805,DB00765,Metyrosine
,7916491,clearance rate (K1),"In striatum, the unidirectional clearance rate (K1) for L-[3H]tyrosine (6.2 ml hg-1 min-1) was significantly greater than the rates for L-[14C]AMPT (2.8 ml hg-1 min-1) and D-[14C]AMPT (0.8 ml hg-1 min-1).",Brain uptake of alpha-[14C]methyl-para-tyrosine in the rat. ,"K12, K21-Q48",[Article Link](https://pubmed.ncbi.nlm.nih.gov/7916491/),[ml] / [hg·min],6.2,210210,DB00765,Metyrosine
,7916491,clearance rate (K1),"In striatum, the unidirectional clearance rate (K1) for L-[3H]tyrosine (6.2 ml hg-1 min-1) was significantly greater than the rates for L-[14C]AMPT (2.8 ml hg-1 min-1) and D-[14C]AMPT (0.8 ml hg-1 min-1).",Brain uptake of alpha-[14C]methyl-para-tyrosine in the rat. ,"K12, K21-Q48",[Article Link](https://pubmed.ncbi.nlm.nih.gov/7916491/),[ml] / [hg·min],2.8,210211,DB00765,Metyrosine
,7916491,clearance rate (K1),"In striatum, the unidirectional clearance rate (K1) for L-[3H]tyrosine (6.2 ml hg-1 min-1) was significantly greater than the rates for L-[14C]AMPT (2.8 ml hg-1 min-1) and D-[14C]AMPT (0.8 ml hg-1 min-1).",Brain uptake of alpha-[14C]methyl-para-tyrosine in the rat. ,"K12, K21-Q48",[Article Link](https://pubmed.ncbi.nlm.nih.gov/7916491/),[ml] / [hg·min],0.8,210212,DB00765,Metyrosine
,7916491,apparent volume of distribution (Vf),The apparent volume of distribution (Vf) for L-[14C]AMPT in striatum (72.5 +/- 4.0 ml hg-1) did not differ from the Vf in other brain regions.,Brain uptake of alpha-[14C]methyl-para-tyrosine in the rat. ,V-Q61,[Article Link](https://pubmed.ncbi.nlm.nih.gov/7916491/),[ml] / [hg],72.5,210213,DB00765,Metyrosine
