Compare,PMID,Parameter,Sentece,Title,Type,URL,Units,Value,id,Drugbank_id,Name
,31545497,IC50,"The in vitro experiments suggested that ticagrelor inhibited CYP3A4 activity, with IC50 and inhibitor constant (Ki) values of 68.74 and 26.47 µM, respectively; prasugrel also inhibited CYP3A4, activity with IC50 and Ki values of 16.24 and 10.84 µM, respectively.",Evaluation of cytochrome P450 3A4‑mediated drug‑drug interaction potential between P2Y12 inhibitors and statins. ,IC50-Q10,[Article Link](https://pubmed.ncbi.nlm.nih.gov/31545497/),μM,68.74,219,DB00641,Simvastatin
,31545497,inhibitor constant (Ki),"The in vitro experiments suggested that ticagrelor inhibited CYP3A4 activity, with IC50 and inhibitor constant (Ki) values of 68.74 and 26.47 µM, respectively; prasugrel also inhibited CYP3A4, activity with IC50 and Ki values of 16.24 and 10.84 µM, respectively.",Evaluation of cytochrome P450 3A4‑mediated drug‑drug interaction potential between P2Y12 inhibitors and statins. ,Ki-Q11,[Article Link](https://pubmed.ncbi.nlm.nih.gov/31545497/),μM,26.47,220,DB00641,Simvastatin
,31545497,IC50,"The in vitro experiments suggested that ticagrelor inhibited CYP3A4 activity, with IC50 and inhibitor constant (Ki) values of 68.74 and 26.47 µM, respectively; prasugrel also inhibited CYP3A4, activity with IC50 and Ki values of 16.24 and 10.84 µM, respectively.",Evaluation of cytochrome P450 3A4‑mediated drug‑drug interaction potential between P2Y12 inhibitors and statins. ,IC50-Q10,[Article Link](https://pubmed.ncbi.nlm.nih.gov/31545497/),μM,16.24,221,DB00641,Simvastatin
,31545497,Ki,"The in vitro experiments suggested that ticagrelor inhibited CYP3A4 activity, with IC50 and inhibitor constant (Ki) values of 68.74 and 26.47 µM, respectively; prasugrel also inhibited CYP3A4, activity with IC50 and Ki values of 16.24 and 10.84 µM, respectively.",Evaluation of cytochrome P450 3A4‑mediated drug‑drug interaction potential between P2Y12 inhibitors and statins. ,Ki-Q11,[Article Link](https://pubmed.ncbi.nlm.nih.gov/31545497/),μM,10.84,222,DB00641,Simvastatin
,21632965,oral clearance,"The predicted oral clearance values of the drugs investigated ranged from 8.79 to 6320 l/h for tacrolimus and simvastatin, respectively, and were overall within 3-fold of the observed data with the exception of indinavir, atorvastatin, and buspirone.",Physiologically based pharmacokinetic modeling of intestinal first-pass metabolism of CYP3A substrates with high intestinal extraction. ,CLpo-Q27,[Article Link](https://pubmed.ncbi.nlm.nih.gov/21632965/),[l] / [h],8.79 to 6320,1970,DB00641,Simvastatin
,21632965,CLu(int),"The individual HJM CLu(int) values ranged from 17 to 14,000 μl · min(-1) · mg(-1) for atorvastatin and saquinavir, respectively, and corresponding interindividual variability in CLu(int) estimates ranged from 41 to 67%.",Physiologically based pharmacokinetic modeling of intestinal first-pass metabolism of CYP3A substrates with high intestinal extraction. ,CLu-Q24,[Article Link](https://pubmed.ncbi.nlm.nih.gov/21632965/),[μl] / [mg·min],"17 to 14,000",1971,DB00641,Simvastatin
,21632965,F(G),"These in vitro data resulted in predicted F(G) values ranging from 0.03 to 0.94 for simvastatin and indinavir, respectively.",Physiologically based pharmacokinetic modeling of intestinal first-pass metabolism of CYP3A substrates with high intestinal extraction. ,NIL-Q100,[Article Link](https://pubmed.ncbi.nlm.nih.gov/21632965/),,0,1972,DB00641,Simvastatin
,16640453,absolute bioavailability,The absolute bioavailability ranges from 35% to 50%.,Clinical pharmacokinetics of ranolazine. ,F-Q40,[Article Link](https://pubmed.ncbi.nlm.nih.gov/16640453/),%,35,3347,DB00641,Simvastatin
,16640453,absolute bioavailability,The absolute bioavailability ranges from 35% to 50%.,Clinical pharmacokinetics of ranolazine. ,F-Q40,[Article Link](https://pubmed.ncbi.nlm.nih.gov/16640453/),%,50,3348,DB00641,Simvastatin
,16640453,protein binding,Ranolazine protein binding is about 61-64% over the therapeutic concentration range.,Clinical pharmacokinetics of ranolazine. ,fu-Q46,[Article Link](https://pubmed.ncbi.nlm.nih.gov/16640453/),%,61-64,3349,DB00641,Simvastatin
,16640453,Volume of distribution at steady state,Volume of distribution at steady state ranges from 85 to 180 L.,Clinical pharmacokinetics of ranolazine. ,Vss-Q65,[Article Link](https://pubmed.ncbi.nlm.nih.gov/16640453/),l,85 to 180,3350,DB00641,Simvastatin
,16640453,Elimination half-life,"Elimination half-life of ranolazine is 1.4-1.9 hours but is apparently prolonged, on average, to 7 hours for the ER formulation as a result of extended absorption (flip-flop kinetics).",Clinical pharmacokinetics of ranolazine. ,"t1/2,β-Q60",[Article Link](https://pubmed.ncbi.nlm.nih.gov/16640453/),h,1.4-1.9,3351,DB00641,Simvastatin
,16640453,Elimination half-life,"Elimination half-life of ranolazine is 1.4-1.9 hours but is apparently prolonged, on average, to 7 hours for the ER formulation as a result of extended absorption (flip-flop kinetics).",Clinical pharmacokinetics of ranolazine. ,"t1/2,β-Q60",[Article Link](https://pubmed.ncbi.nlm.nih.gov/16640453/),h,7,3352,DB00641,Simvastatin
,16640453,Oral plasma clearance,"Oral plasma clearance diminishes with dose from, on average, 45 L/h at 500 mg twice daily to 33 L/h at 1000 mg twice daily.",Clinical pharmacokinetics of ranolazine. ,CLpo-Q27,[Article Link](https://pubmed.ncbi.nlm.nih.gov/16640453/),[l] / [h],45,3353,DB00641,Simvastatin
,16640453,Oral plasma clearance,"Oral plasma clearance diminishes with dose from, on average, 45 L/h at 500 mg twice daily to 33 L/h at 1000 mg twice daily.",Clinical pharmacokinetics of ranolazine. ,CLpo-Q27,[Article Link](https://pubmed.ncbi.nlm.nih.gov/16640453/),[l] / [h],33,3354,DB00641,Simvastatin
,16097365,peak concentration (C(max)),Combined treatment with simvastatin and amlodipine increased the peak concentration (C(max)) of HMG-CoA reductase inhibitors from 9.6 +/- 3.7 ng/ml to 13.7 +/- 4.7 ng/ml (p < 0.05) and the area under the concentration-time curve (AUC) from 34.3 +/- 16.5 ng h/ml to 43.9 +/- 16.6 ng h/ml (p < 0.05) without affecting the cholesterol-lowering effect of simvastatin.,Interaction between amlodipine and simvastatin in patients with hypercholesterolemia and hypertension. ,Cmax-Q32,[Article Link](https://pubmed.ncbi.nlm.nih.gov/16097365/),[ng] / [ml],9.6,9523,DB00641,Simvastatin
,16097365,peak concentration (C(max)),Combined treatment with simvastatin and amlodipine increased the peak concentration (C(max)) of HMG-CoA reductase inhibitors from 9.6 +/- 3.7 ng/ml to 13.7 +/- 4.7 ng/ml (p < 0.05) and the area under the concentration-time curve (AUC) from 34.3 +/- 16.5 ng h/ml to 43.9 +/- 16.6 ng h/ml (p < 0.05) without affecting the cholesterol-lowering effect of simvastatin.,Interaction between amlodipine and simvastatin in patients with hypercholesterolemia and hypertension. ,Cmax-Q32,[Article Link](https://pubmed.ncbi.nlm.nih.gov/16097365/),[ng] / [ml],13.7,9524,DB00641,Simvastatin
,16097365,area under the concentration-time curve (AUC),Combined treatment with simvastatin and amlodipine increased the peak concentration (C(max)) of HMG-CoA reductase inhibitors from 9.6 +/- 3.7 ng/ml to 13.7 +/- 4.7 ng/ml (p < 0.05) and the area under the concentration-time curve (AUC) from 34.3 +/- 16.5 ng h/ml to 43.9 +/- 16.6 ng h/ml (p < 0.05) without affecting the cholesterol-lowering effect of simvastatin.,Interaction between amlodipine and simvastatin in patients with hypercholesterolemia and hypertension. ,AUCinf-Q17,[Article Link](https://pubmed.ncbi.nlm.nih.gov/16097365/),[h·ng] / [ml],34.3,9525,DB00641,Simvastatin
,16097365,area under the concentration-time curve (AUC),Combined treatment with simvastatin and amlodipine increased the peak concentration (C(max)) of HMG-CoA reductase inhibitors from 9.6 +/- 3.7 ng/ml to 13.7 +/- 4.7 ng/ml (p < 0.05) and the area under the concentration-time curve (AUC) from 34.3 +/- 16.5 ng h/ml to 43.9 +/- 16.6 ng h/ml (p < 0.05) without affecting the cholesterol-lowering effect of simvastatin.,Interaction between amlodipine and simvastatin in patients with hypercholesterolemia and hypertension. ,AUCinf-Q17,[Article Link](https://pubmed.ncbi.nlm.nih.gov/16097365/),[h·ng] / [ml],43.9,9526,DB00641,Simvastatin
,15811174,Serum concentration,"Serum concentration of cerivastatin at 6 h after taking the last dose (0.15 mg) was 8062.5 ng/L, which was almost 5.7 times higher than that of normal persons.",Clearance rates of cerivastatin metabolites in a patient with cerivastatin-induced rhabdomyolysis. ,Cmax-Q32,[Article Link](https://pubmed.ncbi.nlm.nih.gov/15811174/),[ng] / [l],8062.5,9832,DB00641,Simvastatin
,15811174,half-life,"The serum concentration of cerivastatin showed that the half-life of cerivastatin in this patient was 22.4 h, compared with 2.4 h for normal controls.",Clearance rates of cerivastatin metabolites in a patient with cerivastatin-induced rhabdomyolysis. ,t1/2-Q57,[Article Link](https://pubmed.ncbi.nlm.nih.gov/15811174/),h,22.4,9833,DB00641,Simvastatin
,15811174,half-life,"The serum concentration of cerivastatin showed that the half-life of cerivastatin in this patient was 22.4 h, compared with 2.4 h for normal controls.",Clearance rates of cerivastatin metabolites in a patient with cerivastatin-induced rhabdomyolysis. ,t1/2-Q57,[Article Link](https://pubmed.ncbi.nlm.nih.gov/15811174/),h,2.4,9834,DB00641,Simvastatin
<,26802130,tumor to plasma partition coefficient,"SVA exposure in tECF was <33.8 ± 11.9 µg/l per hour, whereas the tumor to plasma partition coefficient of SVA was <0.084 ± 0.008.",Simvastatin Hydroxy Acid Fails to Attain Sufficient Central Nervous System Tumor Exposure to Achieve a Cytotoxic Effect: Results of a Preclinical Cerebral Microdialysis Study. ,NIL-Q100,[Article Link](https://pubmed.ncbi.nlm.nih.gov/26802130/),,0.084,11170,DB00641,Simvastatin
,32918160,oral bioavailability,"However, due to its poor intrinsic water solubility, the drug is poorly absorbed from the gastrointestinal tract and exhibits a low oral bioavailability of approximately 5%.","A safety, tolerability, and pharmacokinetic study of a novel simvastatin silica-lipid hybrid formulation in healthy male participants. ",F-Q40,[Article Link](https://pubmed.ncbi.nlm.nih.gov/32918160/),%,5,12006,DB00641,Simvastatin
,24556278,absolute bioavailability,The absolute bioavailability of calenduloside E was only 0.58%.,Pharmacokinetic study of calenduloside E and its active metabolite oleanolic acid in beagle dog using liquid chromatography-tandem mass spectrometry. ,F-Q40,[Article Link](https://pubmed.ncbi.nlm.nih.gov/24556278/),%,0.58,18841,DB00641,Simvastatin
,12942850,elimination half-life,"It is mainly eliminated in the faeces, with an elimination half-life in humans of between 13 and 21 hours.","[Pharmacologic characteristics of rosuvastatin, a new HMG-CoA reductase inhibitor]. ","t1/2,β-Q60",[Article Link](https://pubmed.ncbi.nlm.nih.gov/12942850/),h,13 and 21,26698,DB00641,Simvastatin
,8198018,half-life,"Fluvastatin is rapidly absorbed from the gastrointestinal tract; has a 30-minute half-life, the shortest of any currently available HMG-CoA reductase inhibitor (lovastatin, 15 hours; pravastatin, 2 hours; simvastatin, 15.6 hours); is highly selective for the liver, undergoing extensive first-pass metabolism; has no active circulating metabolites; and does not penetrate the blood-brain barrier, unlike lovastatin and simvastatin.",Clinical implications of the biopharmaceutical properties of fluvastatin. ,t1/2-Q57,[Article Link](https://pubmed.ncbi.nlm.nih.gov/8198018/),min,30,27657,DB00641,Simvastatin
,8198018,half-life,"Fluvastatin is rapidly absorbed from the gastrointestinal tract; has a 30-minute half-life, the shortest of any currently available HMG-CoA reductase inhibitor (lovastatin, 15 hours; pravastatin, 2 hours; simvastatin, 15.6 hours); is highly selective for the liver, undergoing extensive first-pass metabolism; has no active circulating metabolites; and does not penetrate the blood-brain barrier, unlike lovastatin and simvastatin.",Clinical implications of the biopharmaceutical properties of fluvastatin. ,t1/2-Q57,[Article Link](https://pubmed.ncbi.nlm.nih.gov/8198018/),h,15,27658,DB00641,Simvastatin
,8198018,half-life,"Fluvastatin is rapidly absorbed from the gastrointestinal tract; has a 30-minute half-life, the shortest of any currently available HMG-CoA reductase inhibitor (lovastatin, 15 hours; pravastatin, 2 hours; simvastatin, 15.6 hours); is highly selective for the liver, undergoing extensive first-pass metabolism; has no active circulating metabolites; and does not penetrate the blood-brain barrier, unlike lovastatin and simvastatin.",Clinical implications of the biopharmaceutical properties of fluvastatin. ,t1/2-Q57,[Article Link](https://pubmed.ncbi.nlm.nih.gov/8198018/),h,2,27659,DB00641,Simvastatin
,8198018,half-life,"Fluvastatin is rapidly absorbed from the gastrointestinal tract; has a 30-minute half-life, the shortest of any currently available HMG-CoA reductase inhibitor (lovastatin, 15 hours; pravastatin, 2 hours; simvastatin, 15.6 hours); is highly selective for the liver, undergoing extensive first-pass metabolism; has no active circulating metabolites; and does not penetrate the blood-brain barrier, unlike lovastatin and simvastatin.",Clinical implications of the biopharmaceutical properties of fluvastatin. ,t1/2-Q57,[Article Link](https://pubmed.ncbi.nlm.nih.gov/8198018/),h,15.6,27660,DB00641,Simvastatin
,10976543,peak concentration,"The peak concentration of simvastatin acid was increased by 112%, from 3.20 +/- 2.73 ng/mL to 6.78 +/- 4.67 ng/mL (mean +/- SD; P < .01).",Plasma concentrations of active simvastatin acid are increased by gemfibrozil. ,Cmax-Q32,[Article Link](https://pubmed.ncbi.nlm.nih.gov/10976543/),[ng] / [ml],3.20,28337,DB00641,Simvastatin
,10976543,peak concentration,"The peak concentration of simvastatin acid was increased by 112%, from 3.20 +/- 2.73 ng/mL to 6.78 +/- 4.67 ng/mL (mean +/- SD; P < .01).",Plasma concentrations of active simvastatin acid are increased by gemfibrozil. ,Cmax-Q32,[Article Link](https://pubmed.ncbi.nlm.nih.gov/10976543/),[ng] / [ml],6.78,28338,DB00641,Simvastatin
,11073847,area under the RLP-C curve,"Before treatment, FH patients had significantly higher fasting and postprandial concentrations of lipoprotein remnants (plasma RLP-C 42+/-19 mg/dL and area under the RLP-C curve 415+/-82 mg.",High dose of simvastatin normalizes postprandial remnant-like particle response in patients with heterozygous familial hypercholesterolemia. ,AUCinf-Q17,[Article Link](https://pubmed.ncbi.nlm.nih.gov/11073847/),mg,415,34138,DB00641,Simvastatin
,11073847,RE,"Postprandial RE in the Sf<1000 fraction, not total RE in plasma, was also significantly higher in FH patients than in control subjects (24+/-10 versus 6.3+/-5.9 mg.",High dose of simvastatin normalizes postprandial remnant-like particle response in patients with heterozygous familial hypercholesterolemia. ,NIL-Q100,[Article Link](https://pubmed.ncbi.nlm.nih.gov/11073847/),,24,34139,DB00641,Simvastatin
,11073847,RE,"Postprandial RE in the Sf<1000 fraction, not total RE in plasma, was also significantly higher in FH patients than in control subjects (24+/-10 versus 6.3+/-5.9 mg.",High dose of simvastatin normalizes postprandial remnant-like particle response in patients with heterozygous familial hypercholesterolemia. ,NIL-Q100,[Article Link](https://pubmed.ncbi.nlm.nih.gov/11073847/),,6.3,34140,DB00641,Simvastatin
more,26572385,residence,The in vivo residence of thiomer placebo was more than 7h in rabbit.,Formulation of mucoadhesive gastric retentive drug delivery using thiolated xyloglucan. ,MRT-Q53,[Article Link](https://pubmed.ncbi.nlm.nih.gov/26572385/),h,7,42157,DB00641,Simvastatin
,27052517,IC50,"In vitro experiments suggested the inhibitory effect of EGCG on CYP enzymes (IC50: 18.37 ± 1.36 μM, 26.08 ± 1.51 μM for simvastatin and simvastatin acid, respectively).",Epigallocatechin-3-gallate decreases the transport and metabolism of simvastatin in rats. ,IC50-Q10,[Article Link](https://pubmed.ncbi.nlm.nih.gov/27052517/),μM,18.37,45135,DB00641,Simvastatin
,27052517,IC50,"In vitro experiments suggested the inhibitory effect of EGCG on CYP enzymes (IC50: 18.37 ± 1.36 μM, 26.08 ± 1.51 μM for simvastatin and simvastatin acid, respectively).",Epigallocatechin-3-gallate decreases the transport and metabolism of simvastatin in rats. ,IC50-Q10,[Article Link](https://pubmed.ncbi.nlm.nih.gov/27052517/),μM,26.08,45136,DB00641,Simvastatin
,27052517,IC50,"Simvastatin transport by OATP1B1 and OATP1B3 was also inhibited by EGCG (IC50: 8.68 ± 1.27 μM and 22.67 ± 1.42 μM, respectively).",Epigallocatechin-3-gallate decreases the transport and metabolism of simvastatin in rats. ,IC50-Q10,[Article Link](https://pubmed.ncbi.nlm.nih.gov/27052517/),μM,8.68,45137,DB00641,Simvastatin
,27052517,IC50,"Simvastatin transport by OATP1B1 and OATP1B3 was also inhibited by EGCG (IC50: 8.68 ± 1.27 μM and 22.67 ± 1.42 μM, respectively).",Epigallocatechin-3-gallate decreases the transport and metabolism of simvastatin in rats. ,IC50-Q10,[Article Link](https://pubmed.ncbi.nlm.nih.gov/27052517/),μM,22.67,45138,DB00641,Simvastatin
>,9620098,trough:peak ratios,"Favorable hemodynamic and clinical profiles are reported, including high trough:peak ratios (> 80%), high oral bioavailability, and long elimination half-life (17-25 hrs) permitting once/day dosing.","Mibefradil, a pharmacologically distinct calcium antagonist. ",NIL-Q100,[Article Link](https://pubmed.ncbi.nlm.nih.gov/9620098/),%,80,47827,DB00641,Simvastatin
,9620098,elimination half-life,"Favorable hemodynamic and clinical profiles are reported, including high trough:peak ratios (> 80%), high oral bioavailability, and long elimination half-life (17-25 hrs) permitting once/day dosing.","Mibefradil, a pharmacologically distinct calcium antagonist. ","t1/2,β-Q60",[Article Link](https://pubmed.ncbi.nlm.nih.gov/9620098/),h,17-25,47828,DB00641,Simvastatin
,9797793,oral area under the serum concentration-time curve (AUC),Diltiazem significantly (P < .05) increased the oral area under the serum concentration-time curve (AUC) of lovastatin from 3607 +/- 1525 ng/ml/min (mean +/- SD) to 12886 +/- 6558 ng/ml/min and maximum serum concentration (Cmax) from 6 +/- 2 to 26 +/- 9 ng/ml but did not influence the elimination half-life.,The interaction of diltiazem with lovastatin and pravastatin. ,AUCinf-Q17,[Article Link](https://pubmed.ncbi.nlm.nih.gov/9797793/),[ng] / [min·ml],3607,52016,DB00641,Simvastatin
,9797793,oral area under the serum concentration-time curve (AUC),Diltiazem significantly (P < .05) increased the oral area under the serum concentration-time curve (AUC) of lovastatin from 3607 +/- 1525 ng/ml/min (mean +/- SD) to 12886 +/- 6558 ng/ml/min and maximum serum concentration (Cmax) from 6 +/- 2 to 26 +/- 9 ng/ml but did not influence the elimination half-life.,The interaction of diltiazem with lovastatin and pravastatin. ,AUCinf-Q17,[Article Link](https://pubmed.ncbi.nlm.nih.gov/9797793/),[ng] / [min·ml],12886,52017,DB00641,Simvastatin
,9797793,maximum serum concentration (Cmax),Diltiazem significantly (P < .05) increased the oral area under the serum concentration-time curve (AUC) of lovastatin from 3607 +/- 1525 ng/ml/min (mean +/- SD) to 12886 +/- 6558 ng/ml/min and maximum serum concentration (Cmax) from 6 +/- 2 to 26 +/- 9 ng/ml but did not influence the elimination half-life.,The interaction of diltiazem with lovastatin and pravastatin. ,Cmax-Q32,[Article Link](https://pubmed.ncbi.nlm.nih.gov/9797793/),[ng] / [ml],6,52018,DB00641,Simvastatin
,9797793,maximum serum concentration (Cmax),Diltiazem significantly (P < .05) increased the oral area under the serum concentration-time curve (AUC) of lovastatin from 3607 +/- 1525 ng/ml/min (mean +/- SD) to 12886 +/- 6558 ng/ml/min and maximum serum concentration (Cmax) from 6 +/- 2 to 26 +/- 9 ng/ml but did not influence the elimination half-life.,The interaction of diltiazem with lovastatin and pravastatin. ,Cmax-Q32,[Article Link](https://pubmed.ncbi.nlm.nih.gov/9797793/),[ng] / [ml],26,52019,DB00641,Simvastatin
,9797793,steady-state serum concentrations,The average steady-state serum concentrations of diltiazem were not significantly different between the lovastatin (130 +/- 58 ng/ml) and pravastatin (110 +/- 30 ng/ml) study arms.,The interaction of diltiazem with lovastatin and pravastatin. ,Cmax-Q32,[Article Link](https://pubmed.ncbi.nlm.nih.gov/9797793/),[ng] / [ml],130,52020,DB00641,Simvastatin
,9797793,steady-state serum concentrations,The average steady-state serum concentrations of diltiazem were not significantly different between the lovastatin (130 +/- 58 ng/ml) and pravastatin (110 +/- 30 ng/ml) study arms.,The interaction of diltiazem with lovastatin and pravastatin. ,Cmax-Q32,[Article Link](https://pubmed.ncbi.nlm.nih.gov/9797793/),[ng] / [ml],110,52021,DB00641,Simvastatin
,32337660,time to peak plasma concentrations (Tmax),"Oral absorption was rapid, with time to peak plasma concentrations (Tmax) occurring at 1 h (fasted) and 2 h (fed) postdose.","Overview of the Clinical Pharmacology of Ertugliflozin, a Novel Sodium-Glucose Cotransporter 2 (SGLT2) Inhibitor. ",tmax-Q56,[Article Link](https://pubmed.ncbi.nlm.nih.gov/32337660/),h,1,52327,DB00641,Simvastatin
,32337660,time to peak plasma concentrations (Tmax),"Oral absorption was rapid, with time to peak plasma concentrations (Tmax) occurring at 1 h (fasted) and 2 h (fed) postdose.","Overview of the Clinical Pharmacology of Ertugliflozin, a Novel Sodium-Glucose Cotransporter 2 (SGLT2) Inhibitor. ",tmax-Q56,[Article Link](https://pubmed.ncbi.nlm.nih.gov/32337660/),h,2,52328,DB00641,Simvastatin
,32337660,terminal phase half-life,The terminal phase half-life ranged from 11 to 18 h and steady-state concentrations were achieved by 6 days after initiating once-daily dosing.,"Overview of the Clinical Pharmacology of Ertugliflozin, a Novel Sodium-Glucose Cotransporter 2 (SGLT2) Inhibitor. ","t1/2,β-Q60",[Article Link](https://pubmed.ncbi.nlm.nih.gov/32337660/),h,11 to 18,52329,DB00641,Simvastatin
,32337660,absolute bioavailability,Ertugliflozin is categorized as a Biopharmaceutical Classification System Class I drug with an absolute bioavailability of ~ 100% under fasted conditions.,"Overview of the Clinical Pharmacology of Ertugliflozin, a Novel Sodium-Glucose Cotransporter 2 (SGLT2) Inhibitor. ",F-Q40,[Article Link](https://pubmed.ncbi.nlm.nih.gov/32337660/),%,100,52330,DB00641,Simvastatin
,28944193,half-life,"The retinal simvastatin concentration decayed exponentially, with a half-life of 1.92-2.41h.",The ocular toxicity and pharmacokinetics of simvastatin following intravitreal injection in mice. ,t1/2-Q57,[Article Link](https://pubmed.ncbi.nlm.nih.gov/28944193/),h,1.92-2.41,62310,DB00641,Simvastatin
,19277959,total run time,"The total run time was 2.8 min and the elution of SA, AD, VS and IS occurred at 1.81, 1.12, 1.14 and 1.81 min, respectively; this was achieved with a mobile phase consisting of 0.02 M ammonium formate (pH 4.5):acetonitrile (20:80, v/v) at a flow rate of 0.50 mL/min on an X-Terra C18 column.","Development and validation of a highly sensitive and robust LC-ESI-MS/MS method for simultaneous quantitation of simvastatin acid, amlodipine and valsartan in human plasma: application to a clinical pharmacokinetic study. ",NIL-Q100,[Article Link](https://pubmed.ncbi.nlm.nih.gov/19277959/),min,2.8,63151,DB00641,Simvastatin
,19277959,flow rate,"The total run time was 2.8 min and the elution of SA, AD, VS and IS occurred at 1.81, 1.12, 1.14 and 1.81 min, respectively; this was achieved with a mobile phase consisting of 0.02 M ammonium formate (pH 4.5):acetonitrile (20:80, v/v) at a flow rate of 0.50 mL/min on an X-Terra C18 column.","Development and validation of a highly sensitive and robust LC-ESI-MS/MS method for simultaneous quantitation of simvastatin acid, amlodipine and valsartan in human plasma: application to a clinical pharmacokinetic study. ",NIL-Q100,[Article Link](https://pubmed.ncbi.nlm.nih.gov/19277959/),[ml] / [min],0.50,63152,DB00641,Simvastatin
,22795942,flow rate,The mobile phase consisted of 0.02% ammonium acetate solution-methanol with a gradient program at a flow rate of 0.3 mL/min.,Simultaneous determination of imperatorin and its 2 metabolites in dog plasma by using liquid chromatography-tandem mass spectrometry. ,NIL-Q100,[Article Link](https://pubmed.ncbi.nlm.nih.gov/22795942/),[ml] / [min],0.3,63641,DB00641,Simvastatin
,32749629,mean dissolution time,"The dissolution parameters revealed a shortening of mean dissolution time from 10.99 to 6.82 min, increasing of dissolution rate during the first 10 min from 1253.15 to 1667.31 μg/min, and enhancing of dissolution efficiency after 60 min from 71.92 to 86.93% for SMV-LSTs versus the commercial SMV tablets.",Enhancing the Hypolipidemic Effect of Simvastatin in Poloxamer-Induced Hyperlipidemic Rats via Liquisolid Approach: Pharmacokinetic and Pharmacodynamic Evaluation. ,Papp-Q6,[Article Link](https://pubmed.ncbi.nlm.nih.gov/32749629/),min,10,65999,DB00641,Simvastatin
,32749629,dissolution rate,"The dissolution parameters revealed a shortening of mean dissolution time from 10.99 to 6.82 min, increasing of dissolution rate during the first 10 min from 1253.15 to 1667.31 μg/min, and enhancing of dissolution efficiency after 60 min from 71.92 to 86.93% for SMV-LSTs versus the commercial SMV tablets.",Enhancing the Hypolipidemic Effect of Simvastatin in Poloxamer-Induced Hyperlipidemic Rats via Liquisolid Approach: Pharmacokinetic and Pharmacodynamic Evaluation. ,Km -Q1,[Article Link](https://pubmed.ncbi.nlm.nih.gov/32749629/),[μg] / [min],1253.,66000,DB00641,Simvastatin
